{
  "schemaVersion": 3,
  "course": "react",
  "evidenceBindingScope": "course-level-files",
  "files": [
    {
      "path": "standard-fast-track/react/assessments/web-and-react-module-check/blueprint.json",
      "sha256": "24bbb0dc95b882c939a515b01fce276f076584dd72013690ad25f34ccf15104f",
      "bytes": 5004
    },
    {
      "path": "workflow/catalog/react/course.json",
      "sha256": "9dfec5c6f8260326367fe838b90b1f7d05d93a51df6a4fb38f56116810092f7e",
      "bytes": 1146
    },
    {
      "path": "workflow/evidence/react/intake-2-critic-education-recheck.json",
      "sha256": "c0731d8681c5c51cdc8b7b9a73931ef187efaa2205e204b5e994767768abecf2",
      "bytes": 11590
    },
    {
      "path": "workflow/evidence/react/intake-2-reconciliation.json",
      "sha256": "85faf5aed36fc755301acef0e70ac264c42fdc8976d385ffbb0e94109bc32096",
      "bytes": 2576
    },
    {
      "path": "workflow/evidence/react/intake-3-critic-education-recheck.json",
      "sha256": "9476fa70d65ac6be0333de44f23a4fe7e4abf1ed7c3cfd7d3f513f5e7c3ac46a",
      "bytes": 3314
    },
    {
      "path": "workflow/evidence/react/intake-3-reconciliation.json",
      "sha256": "fd5259499d1c1b05caffb66d9b835c449de21c05a176538e27b76bb9f817e3d1",
      "bytes": 1655
    },
    {
      "path": "workflow/evidence/react/intake-4-critic-education-recheck.json",
      "sha256": "a45b7311516e88ee0096bbab02902eb85f389ecf1e8456f3dfe91fe0bdc18c05",
      "bytes": 5202
    },
    {
      "path": "workflow/evidence/react/intake-4-reconciliation.json",
      "sha256": "b06d7cdfbf57301d1bf51188e04b5214695e0736b95ce740b00a8e62c7cf7e1d",
      "bytes": 1697
    },
    {
      "path": "workflow/evidence/react/intake-5-critic-education-recheck.json",
      "sha256": "e143ddb7623ef2980466f427c00531a2ea3d817cc0a844841d5a3f1532209a6d",
      "bytes": 10710
    },
    {
      "path": "workflow/evidence/react/intake-5-critic-sme-recheck.json",
      "sha256": "44d70f396835e845b27a8f9bfa2e35890ad674cd2c1cc21cb21542b40011c281",
      "bytes": 7668
    },
    {
      "path": "workflow/evidence/react/intake-critic-education-recheck.json",
      "sha256": "a4cd54f104dd32d9efa4c4f7f175407d098b6528b2b28db4049578e50e465153",
      "bytes": 9994
    },
    {
      "path": "workflow/evidence/react/intake-critic-education.json",
      "sha256": "8462e620f93eec583ca86bc4b5e7ef75b2b2c02f6022de404eb7370ae8e9f068",
      "bytes": 11732
    },
    {
      "path": "workflow/evidence/react/intake-critic-sme-recheck.json",
      "sha256": "a42d5c19416e3373480b374060d913ea94daf8537200747995c3a40069a22f7d",
      "bytes": 6319
    },
    {
      "path": "workflow/evidence/react/intake-critic-sme.json",
      "sha256": "97b07f89b910da95091588526ed8bd6852f47dbb275f85211d851aa960498383",
      "bytes": 9556
    },
    {
      "path": "workflow/evidence/react/intake-reconciliation.json",
      "sha256": "8adf63e75ec79f8edf4dba98e3930904fe8ad1bcc80d99f8f05fbc943137cde8",
      "bytes": 3701
    },
    {
      "path": "workflow/evidence/react/intake.md",
      "sha256": "476e8a2bf016df6f3a32cab1c367eacafb1ca5bcf59e36c46b4cd0ff32acdd39",
      "bytes": 62537
    },
    {
      "path": "workflow/evidence/react/source-snapshot.json",
      "sha256": "4df26d4175e0eb587be89ccf14e07de6ccf6c543e258a375bfc110132e3cc1b2",
      "bytes": 26983
    }
  ],
  "evidenceBindings": [
    {
      "evidencePath": "workflow/evidence/react/intake-2-critic-education-recheck.json",
      "field": "artifactHashes.assessments/web-and-react-module-check/blueprint.json",
      "artifactPath": "standard-fast-track/react/assessments/web-and-react-module-check/blueprint.json",
      "sha256": "5aef8b6dabd805dd894784ac8e03fbbce0e35ee1ac29b0c7f56bd99994182567",
      "current": false
    },
    {
      "evidencePath": "workflow/evidence/react/intake-2-critic-education-recheck.json",
      "field": "findings[0].reviewedSha256",
      "artifactPath": "workflow/evidence/react/intake.md",
      "sha256": "e2f336548343da0c67bc622f6484daf0e040962817e9ca4c74a42fc1b66d1241",
      "current": false
    },
    {
      "evidencePath": "workflow/evidence/react/intake-2-critic-education-recheck.json",
      "field": "findings[1].reviewedSha256",
      "artifactPath": "workflow/evidence/react/intake.md",
      "sha256": "e2f336548343da0c67bc622f6484daf0e040962817e9ca4c74a42fc1b66d1241",
      "current": false
    },
    {
      "evidencePath": "workflow/evidence/react/intake-2-critic-education-recheck.json",
      "field": "findings[2].reviewedSha256",
      "artifactPath": "workflow/evidence/react/intake.md",
      "sha256": "e2f336548343da0c67bc622f6484daf0e040962817e9ca4c74a42fc1b66d1241",
      "current": false
    },
    {
      "evidencePath": "workflow/evidence/react/intake-2-critic-education-recheck.json",
      "field": "recheck.items[0].reviewedSha256",
      "artifactPath": "standard-fast-track/react/assessments/web-and-react-module-check/blueprint.json",
      "sha256": "5aef8b6dabd805dd894784ac8e03fbbce0e35ee1ac29b0c7f56bd99994182567",
      "current": false
    },
    {
      "evidencePath": "workflow/evidence/react/intake-2-critic-education-recheck.json",
      "field": "recheck.items[1].reviewedSha256",
      "artifactPath": "standard-fast-track/react/assessments/web-and-react-module-check/blueprint.json",
      "sha256": "5aef8b6dabd805dd894784ac8e03fbbce0e35ee1ac29b0c7f56bd99994182567",
      "current": false
    },
    {
      "evidencePath": "workflow/evidence/react/intake-2-critic-education-recheck.json",
      "field": "recheck.items[3].reviewedSha256",
      "artifactPath": "workflow/evidence/react/intake.md",
      "sha256": "f358e488a356ca65852047977484fc7bc8927359f6d8c0975b70394f64fbd962",
      "current": false
    },
    {
      "evidencePath": "workflow/evidence/react/intake-2-critic-education-recheck.json",
      "field": "recheck.items[4].reviewedSha256",
      "artifactPath": "workflow/evidence/react/intake.md",
      "sha256": "f358e488a356ca65852047977484fc7bc8927359f6d8c0975b70394f64fbd962",
      "current": false
    },
    {
      "evidencePath": "workflow/evidence/react/intake-2-critic-education-recheck.json",
      "field": "recheck.items[5].reviewedSha256",
      "artifactPath": "workflow/evidence/react/intake.md",
      "sha256": "f358e488a356ca65852047977484fc7bc8927359f6d8c0975b70394f64fbd962",
      "current": false
    },
    {
      "evidencePath": "workflow/evidence/react/intake-2-critic-education-recheck.json",
      "field": "recheck.items[6].reviewedSha256",
      "artifactPath": "workflow/evidence/react/intake.md",
      "sha256": "f358e488a356ca65852047977484fc7bc8927359f6d8c0975b70394f64fbd962",
      "current": false
    },
    {
      "evidencePath": "workflow/evidence/react/intake-2-critic-education-recheck.json",
      "field": "reviewedSha256",
      "artifactPath": "standard-fast-track/react/assessments/web-and-react-module-check/blueprint.json",
      "sha256": "5aef8b6dabd805dd894784ac8e03fbbce0e35ee1ac29b0c7f56bd99994182567",
      "current": false
    },
    {
      "evidencePath": "workflow/evidence/react/intake-2-reconciliation.json",
      "field": "reviewedSha256",
      "artifactPath": "standard-fast-track/react/assessments/web-and-react-module-check/blueprint.json",
      "sha256": "5aef8b6dabd805dd894784ac8e03fbbce0e35ee1ac29b0c7f56bd99994182567",
      "current": false
    },
    {
      "evidencePath": "workflow/evidence/react/intake-3-critic-education-recheck.json",
      "field": "findings[0].reviewedSha256",
      "artifactPath": "workflow/evidence/react/intake.md",
      "sha256": "cd1f2ad9f06b8dbc38c97f243837cee6803be557f43303a90e92dd50cb44256b",
      "current": false
    },
    {
      "evidencePath": "workflow/evidence/react/intake-3-critic-education-recheck.json",
      "field": "recheck.items[0].reviewedSha256",
      "artifactPath": "workflow/evidence/react/intake.md",
      "sha256": "cd1f2ad9f06b8dbc38c97f243837cee6803be557f43303a90e92dd50cb44256b",
      "current": false
    },
    {
      "evidencePath": "workflow/evidence/react/intake-3-critic-education-recheck.json",
      "field": "recheck.items[1].reviewedSha256",
      "artifactPath": "workflow/evidence/react/intake.md",
      "sha256": "cd1f2ad9f06b8dbc38c97f243837cee6803be557f43303a90e92dd50cb44256b",
      "current": false
    },
    {
      "evidencePath": "workflow/evidence/react/intake-3-critic-education-recheck.json",
      "field": "reviewedSha256",
      "artifactPath": "workflow/evidence/react/intake.md",
      "sha256": "cd1f2ad9f06b8dbc38c97f243837cee6803be557f43303a90e92dd50cb44256b",
      "current": false
    },
    {
      "evidencePath": "workflow/evidence/react/intake-3-reconciliation.json",
      "field": "reviewedSha256",
      "artifactPath": "standard-fast-track/react/assessments/web-and-react-module-check/blueprint.json",
      "sha256": "5aef8b6dabd805dd894784ac8e03fbbce0e35ee1ac29b0c7f56bd99994182567",
      "current": false
    },
    {
      "evidencePath": "workflow/evidence/react/intake-4-critic-education-recheck.json",
      "field": "artifactHashes.assessments/web-and-react-module-check/blueprint.json",
      "artifactPath": "standard-fast-track/react/assessments/web-and-react-module-check/blueprint.json",
      "sha256": "5aef8b6dabd805dd894784ac8e03fbbce0e35ee1ac29b0c7f56bd99994182567",
      "current": false
    },
    {
      "evidencePath": "workflow/evidence/react/intake-4-critic-education-recheck.json",
      "field": "recheck.items[0].reviewedSha256",
      "artifactPath": "standard-fast-track/react/assessments/web-and-react-module-check/blueprint.json",
      "sha256": "5aef8b6dabd805dd894784ac8e03fbbce0e35ee1ac29b0c7f56bd99994182567",
      "current": false
    },
    {
      "evidencePath": "workflow/evidence/react/intake-4-critic-education-recheck.json",
      "field": "recheck.items[1].reviewedSha256",
      "artifactPath": "standard-fast-track/react/assessments/web-and-react-module-check/blueprint.json",